{
  "$schema": "./repos.schema.json",
  "schemaVersion": "1.0.0",
  "organization": "OpenPhysics",
  "displayName": "OpenPhysics",
  "pagesBase": null,
  "repos": [
    {
      "name": ".github",
      "displayName": ".github",
      "type": "config",
      "language": ["Markdown"],
      "description": "Community health files and public profile for the OpenPhysics organization.",
      "deployedUrl": null,
      "githubTopics": ["community-health", "organization-profile"],
      "status": "active"
    },
    {
      "name": "relay",
      "displayName": "relay",
      "type": "tool",
      "language": ["Shell", "JavaScript"],
      "description": "Orchestration repository for the OpenPhysics organization: reusable CI/CD workflows, cross-repo automation scripts, Dependabot templates, and the machine-readable repository catalog.",
      "githubTopics": ["orchestration", "tooling", "ci-cd"],
      "status": "active"
    },
    {
      "name": "pyro",
      "displayName": "Pyro",
      "type": "app",
      "language": ["JavaScript"],
      "description": "Browser-based VPython editor using CodeMirror 6 and GlowScript VPython 3.2. Write and run VPython code in the browser with live 3D visualization.",
      "githubTopics": ["vpython", "glowscript", "codemirror", "physics-simulation"],
      "status": "active"
    },
    {
      "name": "pycd48",
      "displayName": "pycd48",
      "type": "library",
      "language": ["Python"],
      "description": "Python library for controlling the CD48 Coincidence Counter via USB serial. Supports Linux, macOS, and Windows.",
      "githubTopics": ["physics", "hardware", "serial", "coincidence-counter"],
      "status": "active"
    },
    {
      "name": "jscd48-tmp",
      "displayName": "jscd48",
      "type": "library",
      "language": ["JavaScript"],
      "description": "JavaScript library for controlling the CD48 Coincidence Counter via the Web Serial API. Published to npm.",
      "githubTopics": ["physics", "hardware", "web-serial", "coincidence-counter"],
      "status": "active"
    },
    {
      "name": "tscd48-tmp",
      "displayName": "tscd48",
      "type": "library",
      "language": ["TypeScript"],
      "description": "TypeScript library for controlling the CD48 Coincidence Counter via the Web Serial API. Published to npm.",
      "githubTopics": ["physics", "hardware", "web-serial", "coincidence-counter"],
      "status": "active"
    },
    {
      "name": "vscene2d",
      "displayName": "vscene2d",
      "type": "library",
      "language": ["Python"],
      "description": "VPython-style 2D physics scenes that run natively in Jupyter.",
      "githubTopics": ["physics", "jupyter", "physics-simulation", "vpython"],
      "status": "active"
    },
    {
      "name": "feelTechFunctionGenerator",
      "displayName": "FeelTech Function Generator",
      "type": "app",
      "language": ["TypeScript"],
      "description": "Control a FeelTech FY3200S function generator from the browser over Web Serial.",
      "deployedUrl": "https://openphysics.github.io/feelTechFunctionGenerator",
      "githubTopics": ["web-serial", "function-generator", "physics", "hardware"],
      "status": "active"
    },
    {
      "name": "tektronixOscilloscope",
      "displayName": "Tektronix Oscilloscope",
      "type": "app",
      "language": ["TypeScript"],
      "description": "Capture waveforms from a Tektronix TBS1072B-EDU oscilloscope in the browser over WebUSB/USBTMC.",
      "deployedUrl": "https://openphysics.github.io/tektronixOscilloscope",
      "githubTopics": ["webusb", "oscilloscope", "physics", "hardware"],
      "status": "active"
    },
    {
      "name": "pascoTS",
      "displayName": "pascoTS",
      "type": "library",
      "language": ["TypeScript"],
      "description": "TypeScript/JavaScript library for connecting to PASCO Wireless sensors in web browsers using Web Bluetooth.",
      "githubTopics": ["web-bluetooth", "pasco", "sensors", "physics", "hardware"],
      "status": "active"
    },
    {
      "name": "pasco-BLE-examples",
      "displayName": "PASCO BLE Examples",
      "type": "app",
      "language": ["HTML", "JavaScript"],
      "description": "Examples of HTML pages connecting to PASCO Wireless sensors using Web Bluetooth.",
      "deployedUrl": "https://openphysics.github.io/pasco-BLE-examples/examples/",
      "githubTopics": ["web-bluetooth", "pasco", "sensors", "data-collection", "physics"],
      "status": "active"
    }
  ]
}
